"","Author","Year","Title","Journal","Volume","Issue","Pages"
"39924","Jonsdottir, I. S., Magnusson, B., Gudmundsson, J., Elmarsdottir, A. and Hjartarson, H.",2005,"Variable sensitivity of plant communities in Iceland to experimental warming","Global Change Biology","11","4","553-563"
"63220","Rice, J. C.",2011,"Achieving Coherent Policies for Conservation and Sustainable Use of Marine Ecosystems","Conservation Biology","25"," 6 ","1065-1068"
"64397","Kulhanek, S. A., Leung, B. and Ricciardi, A.",2011,"Using ecological niche models to predict the abundance and impact of invasive species: application to the common carp","Ecological Applications","21"," 1 ","203-213"
"75906","Bramanti, L., Movilla, J., Guron, M., Calvo, E., Gori, A., Dominguez-Carrio, C., Grinyo, J., Lopez-Sanz, A., Martinez-Quintana, A., Pelejero, C., Ziveri, P. and Rossi, S.",2013,"Detrimental effects of ocean acidification on the economically important Mediterranean red coral (Corallium rubrum)","Global Change Biology","19"," 6 ","1897-1908"
"66415","Barrientos, R., Alonso, J. C., Ponce, C. and Palacin, C.",2011,"Meta-Analysis of the Effectiveness of Marked Wire in Reducing Avian Collisions with Power Lines","Conservation Biology","25"," 5 ","893-903"
"69890","Gerlach, N. M., McGlothlin, J. W., Parker, P. G. and Ketterson, E. D.",2012,"Promiscuous mating produces offspring with higher lifetime fitness","Proceedings of the Royal Society B-Biological Sciences","279"," 1730 ","860-866"
"51673","Jacot, A., Scheuber, H., Holzer, B., Otti, O. and Brinkhof, M. W. G.",2008,"Diel variation in a dynamic sexual display and its association with female mate-searching behaviour","Proceedings of the Royal Society B-Biological Sciences","275"," 1634 ","579-585"
"75465","Creutzig, F. and Mattauch, L.",2013,"Beyond GDP: Measuring Welfare and Assessing Sustainability","Ecological Economics","94"," ","164-165"
"40580","Ewert, F., Rounsevell, M. D. A., Reginster, I., Metzger, M. J. and Leemans, R.",2005,"Future scenarios of European agricultural land use I. Estimating changes in crop productivity","Agriculture Ecosystems & Environment","107"," 2-3 ","101-116"
"46953","Miles, B. and Morse, S.",2007,"The role of news media in natural disaster risk and recovery","Ecological Economics","63"," 2-3 ","365-373"
"46996","Melbourne, B. A., Cornell, H. V., Davies, K. F., Dugaw, C. J., Elmendorf, S., Freestone, A. L., Hall, R. J., Harrison, S., Hastings, A., Holland, M., Holyoak, M., Lambrinos, J., Moore, K. and Yokomizo, H.",2007,"Invasion in a heterogeneous world: resistance, coexistence or hostile takeover?","Ecology Letters","10"," 1 ","77-94"
"62966","Schulte, R. D., Makus, C., Hasert, B., Michiels, N. K. and Schulenburg, H.",2011,"Host-parasite local adaptation after experimental coevolution of Caenorhabditis elegans and its microparasite Bacillus thuringiensis","Proceedings of the Royal Society B-Biological Sciences","278"," 1719 ","2832-2839"
"73817","Lereboullet, A. L., Beltrando, G. and Bardsley, D. K.",2013,"Socio-ecological adaptation to climate change: A comparative case study from the Mediterranean wine industry in France and Australia","Agriculture Ecosystems & Environment","164"," ","273-285"
"49556","Webster, C. R., Rock, J. H., Froese, R. E. and Jenkins, M. A.",2008,"Drought-herbivory interaction disrupts competitive displacement of native plants by Microstegium vimineum, 10-year results","Oecologia","157"," 3 ","497-508"
"70781","Bruce, A. I. and Burd, M.",2012,"Allometric scaling of foraging rate with trail dimensions in leaf-cutting ants","Proceedings of the Royal Society B-Biological Sciences","279"," 1737 ","2442-2447"
"63413","Piovia-Scott, J.",2011,"Plant phenotype influences the effect of ant mutualists on a polymorphic mangrove","Journal of Ecology","99"," 1 ","327-334"
"46843","Munksgaard, J., Christoffersen, L. B., Keiding, H., Pedersen, O. G. and Jensen, T. S.",2007,"An environmental performance index for products reflecting damage costs","Ecological Economics","64"," 1 ","119-130"
"41028","Candolin, U.",2005,"Why do multiple traits determine mating success? Differential use in female choice and male competition in a water boatman","Proceedings of the Royal Society B-Biological Sciences","272","1558","47-52"
"43227","Maret, T. J., Snyder, J. D. and Collins, J. P.",2006,"Altered drying regime controls distribution of endangered salamanders and introduced predators","Biological Conservation","127","2","129-138"
"36629","Herath, G.",2004,"Multiple criteria analysis for agricultural decisions, second edition","Ecological Economics","51"," 1-2 ","159-160"
"68922","Leung, T. L. F., King, K. C. and Wolinska, J.",2012,"Escape from the Red Queen: an overlooked scenario in coevolutionary studies","Oikos","121"," 5 ","641-645"
"61166","Daniels, A. E., Bagstad, K., Esposito, V., Moulaert, A. and Rodriguez, C. M.",2010,"Understanding the impacts of Costa Rica's PES: Are we asking the right questions?","Ecological Economics","69"," 11 ","2116-2126"
"64872","Higuera, P. E., Chipman, M. L., Barnes, J. L., Urban, M. A. and Hu, F. S.",2011,"Variability of tundra fire regimes in Arctic Alaska: millennial-scale patterns and ecological implications","Ecological Applications","21"," 8 ","3211-3226"
"34679","Whittingham, M. J., Butler, S. J., Quinn, J. L. and Cresswell, W.",2004,"The effect of limited visibility on vigilance behaviour and speed of predator detection: implications for the conservation of granivorous passerines","Oikos","106","2","377-385"
"64941","Hastings, A., Petrovskii, S. and Morozov, A.",2011,"Spatial ecology across scales","Biology Letters","7"," 2 ","163-165"
"61653","Boisvenue, C. and Running, S. W.",2010,"Simulations show decreasing carbon stocks and potential for carbon emissions in Rocky Mountain forests over the next century","Ecological Applications","20"," 5 ","1302-1319"
"42623","Potts, S. G., Petanidou, T., Roberts, S., O'Toole, C., Hulbert, A. and Willmer, P.",2006,"Plant-pollinator biodiversity and pollination services in a complex Mediterranean landscape","Biological Conservation","129","4","519-529"
"50328","Ronka, M., Tolvanen, H., Lehikoinen, E., von Numers, M. and Rautkari, M.",2008,"Breeding habitat preferences of 15 bird species on south-western Finnish archipelago coast: Applicability of digital spatial data archives to habitat assessment","Biological Conservation","141"," 2 ","402-416"
"53238","Arita, H. T. and Vazquez-Dominguez, E.",2008,"The tropics: cradle, museum or casino? A dynamic null model for latitudinal gradients of species diversity","Ecology Letters","11"," 7 ","653-663"
"38373","Swenson, N. G. and Howard, D. J.",2005,"Clustering of contact zones, hybrid zones, and phylogeographic breaks in North America","American Naturalist","166","5","581-591"
"67977","Pringle, E. G., Dirzo, R. and Gordon, D. M.",2012,"Plant defense, herbivory, and the growth of Cordia alliodora trees and their symbiotic Azteca ant colonies","Oecologia","170"," 3 ","677-685"
"59339","Morgan, S. W., Kirkpatrick, J. B. and di Folco, M. B.",2010,"Wind-controlled linear patterning and cyclic succession in Tasmanian Sphagnum mires","Journal of Ecology","98"," 3 ","583-591"
"42078","Stankowich, T. and Coss, R. G.",2006,"Effects of predator behavior and proximity on risk assessment by Columbian black-tailed deer","Behavioral Ecology","17","2","246-254"
"71734","Visconti, P., Di Marco, M., Alvarez-Romero, J. G., Januchowski-Hartley, S. R., Pressey, R. L., Weeks, R. and Rondinini, C.",2013,"Effects of Errors and Gaps in Spatial Data Sets on Assessment of Conservation Progress","Conservation Biology","27"," 5 ","1000-1010"
"60075","Keller, D., Brodbeck, S., Floss, I., Vonwil, G. and Holderegger, R.",2010,"Ecological and genetic measurements of dispersal in a threatened dragonfly","Biological Conservation","143"," 11 ","2658-2663"
"70823","Bremond, L., Boom, A. and Favier, C.",2012,"Neotropical C3/C4 grass distributions - present, past and future","Global Change Biology","18"," 7 ","2324-2334"
"60404","Hedl, R., Kopecky, M. and Komarek, J.",2010,"Half a century of succession in a temperate oakwood: from species-rich community to mesic forest","Diversity and Distributions","16"," 2 ","267-276"
"37832","Anderson, T. M., Lachance, M. A. and Starmer, W. T.",2004,"The relationship of phylogeny to community structure: The cactus yeast community","American Naturalist","164","6","709-721"
"67125","Tucker, M. A. and Gerhardt, H. C.",2012,"Parallel changes in mate-attracting calls and female preferences in autotriploid tree frogs","Proceedings of the Royal Society B-Biological Sciences","279"," 1733 ","1583-1587"
"72326","Showalter, B.",2013,"African savanna birds populating protected areas","Frontiers in Ecology and the Environment","11"," 6 ","287-287"
"74504","Helmus, M. R., Mercado-Silva, N. and Vander Zanden, M. J.",2013,"Subsidies to predators, apparent competition and the phylogenetic structure of prey communities","Oecologia","173"," 3 ","997-1007"
"47357","Laiolo, P. and Tella, J. L.",2007,"Erosion of animal cultures in fragmented landscapes","Frontiers in Ecology and the Environment","5"," 2 ","68-72"
