"","Author","Year","Title","Journal","Volume","Issue","Pages"
"38227","Urama, K. C.",2005,"Hooked on growth: Economic addictions and the environment","Ecological Economics","55","3","445-448"
"70828","Breecker, D. O., McFadden, L. D., Sharp, Z. D., Martinez, M. and Litvak, M. E.",2012,"Deep Autotrophic Soil Respiration in Shrubland and Woodland Ecosystems in Central New Mexico","Ecosystems","15"," 1 ","83-96"
"78902","",2005,"Mexico addresses desertification","Frontiers in Ecology and the Environment"," 3 ","5","240-240"
"46507","Prairie, Y. T. and Duarte, C. M.",2007,"Direct and indirect metabolic CO2 release by humanity","Biogeosciences","4"," 2 ","215-217"
"41893","Tuljapurkar, S. and Haridas, C. V.",2006,"Temporal autocorrelation and stochastic population growth","Ecology Letters","9","3","324-334"
"58531","Senici, D., Chen, H. Y. H., Bergeron, Y. and Cyr, D.",2010,"Spatiotemporal Variations of Fire Frequency in Central Boreal Forest","Ecosystems","13"," 8 ","1227-1238"
"56626","Eikenaar, C., Richardson, D. S., Brouwer, L., Bristol, R. and Komdeur, J.",2009,"Experimental evaluation of sex differences in territory acquisition in a cooperatively breeding bird","Behavioral Ecology","20"," 1 ","207-214"
"65161","Gilljam, D., Thierry, A., Edwards, F. K., Figueroa, D., Ibbotson, A. T., Jones, J. I., Lauridsen, R. B., Petchey, O. L., Woodward, G. and Ebenman, B.",2011,"Seeing Double: Size-Based and Taxonomic Views of Food Web Structure","Advances in Ecological Research, Vol 45: The Role of Body Size in Multispecies Systems","45"," ","67-133"
"66750","Xu, C. Y., Turnbull, M. H., Tissue, D. T., Lewis, J. D., Carson, R., Schuster, W. S. F., Whitehead, D., Walcroft, A. S., Li, J. B. and Griffin, K. L.",2012,"Age-related decline of stand biomass accumulation is primarily due to mortality and not to reduction in NPP associated with individual tree physiology, tree growth or stand structure in a Quercus-dominated forest","Journal of Ecology","100"," 2 ","428-440"
"67384","Spooner, D. E., Vaughn, C. C. and Galbraith, H. S.",2012,"Species traits and environmental conditions govern the relationship between biodiversity effects across trophic levels","Oecologia","168"," 2 ","533-548"
"41742","Walter, S., Bange, H. W., Breitenbach, U. and Wallace, D. W. R.",2006,"Nitrous oxide in the North Atlantic Ocean","Biogeosciences","3","4","607-619"
"76691","Uecker, H., Otto, S. P. and Hermisson, J.",2014,"Evolutionary Rescue in Structured Populations","American Naturalist","183"," 1 ","E17-E35"
"59722","Lombard, F., da Rocha, R. E., Bijma, J. and Gattuso, J. P.",2010,"Effect of carbonate ion concentration and irradiance on calcification in planktonic foraminifera","Biogeosciences","7"," 1 ","247-255"
"41256","Bengtson, P., Falkengren-Grerup, U. and Bengtsson, G.",2005,"Relieving substrate limitation-soil moisture and temperature determine gross N transformation rates","Oikos","111","1","81-90"
"43323","Lovejoy, N. R., Mullen, S. P., Sword, G. A., Chapman, R. F. and Harrison, R. G.",2006,"Ancient trans-Atlantic flight explains locust biogeography: molecular phylogenetics of Schistocerca","Proceedings of the Royal Society B-Biological Sciences","273","1588","767-774"
"72726","Reino, L., Beja, P., Araujo, M. B., Dray, S. and Segurado, P.",2013,"Does local habitat fragmentation affect large-scale distributions? The case of a specialist grassland bird","Diversity and Distributions","19"," 4 ","423-432"
"56090","Hart, D. R. and Sissenwine, M. P.",2009,"Marine reserve effects on fishery profits: a comment on White et al. (2008)","Ecology Letters","12"," 3 ","E9-E11"
"44085","Gratton, C. and Denno, R. F.",2006,"Arthropod food web restoration following removal of an invasive wetland plant","Ecological Applications","16","2","622-631"
"56034","Henebry, G. M., Richardson, A. D., Breshears, D. D., Abatzoglou, J., Fisher, J. I., Graham, E. A., Hanes, J. M., Knapp, A., Liang, L., Wilson, B. E. and Morisette, J. T.",2009,"Phenological trend estimation: a reply to Sagarin","Frontiers in Ecology and the Environment","7"," 6 ","296-296"
"74534","He, X., Bai, Y., Pan, D., Chen, C. T. A., Cheng, Q., Wang, D. and Gong, F.",2013,"Satellite views of the seasonal and interannual variability of phytoplankton blooms in the eastern China seas over the past 14 yr (1998-2011)","Biogeosciences","10"," 7 ","4721-4739"
"42569","Raberg, L., de Roode, J. C., Bell, A. S., Stamou, P., Gray, D. and Read, A. F.",2006,"The role of immune-mediated apparent competition in genetically diverse malaria infections","American Naturalist","168","1","41-53"
"62606","Thornton, D. H., Branch, L. C. and Sunquist, M. E.",2011,"The influence of landscape, patch, and within-patch factors on species presence and abundance: a review of focal patch studies","Landscape Ecology","26"," 1 ","7-18"
"59248","Newbold, T., Reader, T., El-Gabbas, A., Berg, W., Shohdi, W. M., Zalat, S., El Din, S. B. and Gilbert, F.",2010,"Testing the accuracy of species distribution models using species records from a new field survey","Oikos","119"," 8 ","1326-1334"
"75282","Doblas-Miranda, E., Rovira, P., Brotons, L., Martinez-Vilalta, J., Retana, J., Pla, M. and Vayreda, J.",2013,"Soil carbon stocks and their variability across the forests, shrublands and grasslands of peninsular Spain","Biogeosciences","10"," 12 ","8353-8361"
"40356","Gillespie, T. W.",2005,"Predicting woody-plant species richness in tropical dry forests: A case study from south Florida, USA","Ecological Applications","15","1","27-37"
"49996","Soutullo, A., De Castro, M. and Urios, V.",2008,"Linking political and scientifically derived targets for global biodiversity conservation: implications for the expansion of the global network of protected areas","Diversity and Distributions","14"," 4 ","604-613"
"63938","Meigs, G. W., Turner, D. P., Ritts, W. D., Yang, Z. Q. and Law, B. E.",2011,"Landscape-Scale Simulation of Heterogeneous Fire Effects on Pyrogenic Carbon Emissions, Tree Mortality, and Net Ecosystem Production","Ecosystems","14"," 5 ","758-775"
"64589","Kachel, A. F., Premo, L. S. and Hublin, J. J.",2011,"Grandmothering and natural selection revisited reply","Proceedings of the Royal Society B-Biological Sciences","278"," 1714 ","1939-1941"
"38802","Rohde, K.",2005,"Cellular automata and ecology","Oikos","110","1","203-207"
"44055","Grimm, N., Covich, A. and Melillo, J.",2006,"A vision for ecology's future: where are we today?","Frontiers in Ecology and the Environment","4","3","115-115"
"54116","Seymour, R. S.",2009,"Raising the sauropod neck: it costs more to get less","Biology Letters","5"," 3 ","317-319"
"46665","Palma, J., Graves, A. R., Burgess, P. J., van der Werf, W. and Herzog, F.",2007,"Integrating environmental and economic performance to assess modern silvoarable agroforestry in Europe","Ecological Economics","63"," 4 ","759-767"
"71607","Wenseleers, T., Bacon, J. P., Alves, D. A., Couvillon, M. J., Karcher, M. H., Nascimento, F. S., Nogueira-Neto, P., Ribeiro, M., Robinson, E. J. H., Tofilski, A. and Ratnieks, F. L. W.",2013,"Bourgeois Behavior and Freeloading in the Colonial Orb Web Spider Parawixia bistriata (Araneae, Araneidae)","American Naturalist","182"," 1 ","120-129"
"54670","Pattison, R. R. and Mack, R. N.",2009,"Environmental constraints on the invasion of Triadica sebifera in the eastern United States: an experimental field assessment","Oecologia","158"," 4 ","591-602"
"44313","Fernandez, N., Delibes, M. and Palomares, F.",2006,"Landscape evaluation in conservation: Molecular sampling and habitat modeling for the Iberian lynx","Ecological Applications","16","3","1037-1049"
"59776","Lin, Y., Hong, M., Han, G. D., Zhao, M. L., Bai, Y. F. and Chang, S. X.",2010,"Grazing intensity affected spatial patterns of vegetation and soil fertility in a desert steppe","Agriculture Ecosystems & Environment","138"," 3-4 ","282-292"
"78219","Fa, J. E., Farfan, M. A., Marquez, A. L., Duarte, J., Nackoney, J., Hall, A., Dupain, J., Seymour, S., Johnson, P. J., Macdonald, D. W. and Vargas, J. M.",2014,"Mapping Hotspots of Threatened Species Traded in Bushmeat Markets in the Cross-Sanaga Rivers Region","Conservation Biology","28"," 1 ","224-233"
"45366","Yuste, J. C., Baldocchi, D. D., Gershenson, A., Goldstein, A., Misson, L. and Wong, S.",2007,"Microbial soil respiration and its dependency on carbon inputs, soil temperature and moisture","Global Change Biology","13","9","2018-2035"
"35139","Sharma, D. C.",2004,"Himalayan glaciers vanishing","Frontiers in Ecology and the Environment","2","3","118-118"
"43914","Heg, D., Bergmuller, R., Bonfils, D., Otti, O., Bachar, Z., Burri, R., Heckel, G. and Taborsky, M.",2006,"Cichlids do not adjust reproductive skew to the availability of independent breeding options","Behavioral Ecology","17","3","419-429"
"47107","Marin-Spiotta, E., Ostertag, R. and Silver, W. L.",2007,"Long-term patterns in tropical reforestation: Plant community composition and aboveground biomass accumulation","Ecological Applications","17"," 3 ","828-839"
"39704","Lecchini, D., Shima, J., Banaigs, B. and Galzin, R.",2005,"Larval sensory abilities and mechanisms of habitat selection of a coral reef fish during settlement","Oecologia","143","2","326-334"
"51693","Isbell, F. I., Losure, D. A., Yurkonis, K. A. and Wilsey, B. J.",2008,"Diversity-productivity relationships in two ecologically realistic rarity-extinction scenarios","Oikos","117"," 7 ","996-1005"
"74421","Holitzki, T. M., MacKenzie, R. A., Wiegner, T. N. and McDermid, K. J.",2013,"Differences in ecological structure, function, and native species abundance between native and invaded Hawaiian streams","Ecological Applications","23"," 6 ","1367-1383"
"75031","Firbank, L., Bradbury, R. B., McCracken, D. I. and Stoate, C.",2013,"Delivering multiple ecosystem services from Enclosed Farmland in the UK","Agriculture Ecosystems & Environment","166"," ","65-75"
"44991","Borrvall, C. and Ebenman, B.",2006,"Early onset of secondary extinctions in ecological communities following the loss of top predators","Ecology Letters","9","4","435-442"
"66040","Cardoso, P., Erwin, T. L., Borges, P. A. V. and New, T. R.",2011,"The seven impediments in invertebrate conservation and how to overcome them","Biological Conservation","144"," 11 ","2647-2655"
"45007","Bonds, M. H.",2006,"Host life-history strategy explains pathogen-induced sterility","American Naturalist","168","3","281-293"
"42597","Pringle, H. J. R., Watson, I. W. and Tinley, K. L.",2006,"Landscape improvement, or ongoing degradation - reconciling apparent contradictions from the and rangelands of Western Australia","Landscape Ecology","21","8","1267-1279"
"58843","Reich, P. B., Oleksyn, J., Wright, I. J., Niklas, K. J., Hedin, L. and Elser, J. J.",2010,"Evidence of a general 2/3-power law of scaling leaf nitrogen to phosphorus among major plant groups and biomes","Proceedings of the Royal Society B-Biological Sciences","277"," 1683 ","877-883"
"50998","Meynecke, J. O., Lee, S. Y. and Duke, N. C.",2008,"Linking spatial metrics and fish catch reveals the importance of coastal wetland connectivity to inshore fisheries in Queensland, Australia","Biological Conservation","141"," 4 ","981-996"
"36176","Li, H. B. and Wu, J. G.",2004,"Use and misuse of landscape indices","Landscape Ecology","19","4","389-399"
"67736","Ruan, W. B., Sang, Y., Chen, Q., Zhu, X., Lin, S. and Gao, Y. B.",2012,"The Response of Soil Nematode Community to Nitrogen, Water, and Grazing History in the Inner Mongolian Steppe, China","Ecosystems","15"," 7 ","1121-1133"
"64852","Hladyz, S., Abjornsson, K., Chauvet, E., Dobson, M., Elosegi, A., Ferreira, V., Fleituch, T., Gessner, M. O., Giller, P. S., Gulis, V., Hutton, S. A., Lacoursiere, J. O., Lamothe, S., Lecerf, A., Malmqvist, B., McKie, B. G., Nistorescu, M., Preda, E., Riipinen, M. P., Risnoveanu, G., Schindler, M., Tiegs, S. D., Vought, L. B. M. and Woodward, G.",2011,"Stream Ecosystem Functioning in an Agricultural Landscape: The Importance of Terrestrial-Aquatic Linkages","Advances in Ecological Research, Vol 44","44"," ","211-276"
"74030","Kovacs-Hostyanszki, A., Haenke, S., Batary, P., Jauker, B., Baldi, A., Tscharntke, T. and Holzschuh, A.",2013,"Contrasting effects of mass-flowering crops on bee pollination of hedge plants at different spatial and temporal scales","Ecological Applications","23"," 8 ","1938-1946"
"54826","Norden, N., Chazdon, R. L., Chao, A., Jiang, Y. H. and Vilchez-Alvarado, B.",2009,"Resilience of tropical rain forests: tree community reassembly in secondary forests","Ecology Letters","12"," 5 ","385-394"
"53030","Blair, R. B. and Johnson, E. M.",2008,"Suburban habitats and their role for birds in the urban-rural habitat network: points of local invasion and extinction?","Landscape Ecology","23"," 10 ","1157-1169"
"74813","Gilbert, H.",2013,"'Bedouin overgrazing' and conservation politics: Challenging ideas of pastoral destruction in South Sinai","Biological Conservation","160"," ","59-69"
"72608","Ross, R. E. and Howell, K. L.",2013,"Use of predictive habitat modelling to assess the distribution and extent of the current protection of 'listed' deep-sea habitats","Diversity and Distributions","19"," 4 ","433-445"
"57642","Zurita, G. A. and Bellocq, M. I.",2010,"Spatial patterns of bird community similarity: bird responses to landscape composition and configuration in the Atlantic forest","Landscape Ecology","25"," 1 ","147-158"
"68714","Mair, L., Thomas, C. D., Anderson, B. J., Fox, R., Botham, M. and Hill, J. K.",2012,"Temporal variation in responses of species to four decades of climate warming","Global Change Biology","18"," 8 ","2439-2447"
"61650","Bolinder, M. A., Katterer, T., Andren, O., Ericson, L., Parent, L. E. and Kirchmann, H.",2010,"Long-term soil organic carbon and nitrogen dynamics in forage-based crop rotations in Northern Sweden (63-64 degrees N)","Agriculture Ecosystems & Environment","138"," 3-4 ","335-342"
"75841","Buchanan, G. M., Fishpool, L. D. C., Evans, M. I. and Butchart, S. H. M.",2013,"Comparing field-based monitoring and remote-sensing, using deforestation from logging at Important Bird Areas as a case study","Biological Conservation","167"," ","334-338"
"68623","Mauck, R. A., Huntington, C. E. and Doherty, P. F.",2012,"Experience versus effort: what explains dynamic heterogeneity with respect to age?","Oikos","121"," 9 ","1379-1390"
"36678","Hargreaves, A. L., Johnson, S. D. and Nol, E.",2004,"Do floral syndromes predict specialization in plant pollination systems? An experimental test in an ""ornithophilous"" African Protea","Oecologia","140","2","295-301"
"44758","Chen, B. Z., Chen, J. M., Huang, L. and Tans, P. P.",2006,"Modeling dynamics of stable carbon isotopic exchange between a boreal forest ecosystem and the atmosphere","Global Change Biology","12","10","1842-1867"
"40929","Clark, J. S.",2005,"Why environmental scientists are becoming Bayesians","Ecology Letters","8","1","Feb-14"
"49209","Ayres, E., Wall, D. H., Adams, B. J., Barrett, J. E. and Virginia, R. A.",2007,"Unique similarity of faunal communities across aquatic-terrestrial interfaces in a polar desert ecosystem - Soil-sediment boundaries and faunal community","Ecosystems","10"," 4 ","523-535"
"73614","Magurran, A. E., Queiroz, H. L. and Hercos, A. P.",2013,"Relationship between evenness and body size in species rich assemblages","Biology Letters","9"," 6 ",""
"49175","Ball, T., Smith, K. A. and Moncrieff, J. B.",2007,"Effect of stand age on greenhouse gas fluxes from a Sitka spruce [Picea sitchensis (Bong.) Carr.] chronosequence on a peaty gley soil","Global Change Biology","13"," 10 ","2128-2142"
"62887","Shiels, H. A., Di Maio, A., Thompson, S. and Block, B. A.",2011,"Warm fish with cold hearts: thermal plasticity of excitation-contraction coupling in bluefin tuna","Proceedings of the Royal Society B-Biological Sciences","278"," 1702 ","18-27"
"72622","Roland, M., Serrano-Ortiz, P., Kowalski, A. S., Godderis, Y., Sanchez-Canete, E. P., Ciais, P., Domingo, F., Cuezva, S., Sanchez-Moral, S., Longdoz, B., Yakir, D., Van Grieken, R., Schott, J., Cardell, C. and Janssens, I. A.",2013,"Atmospheric turbulence triggers pronounced diel pattern in karst carbonate geochemistry","Biogeosciences","10"," 7 ","5009-5017"
"34868","Underwood, D. A.",2004,"Unveiling wealth: On money, quality of life and sustainability","Ecological Economics","51"," 1-2 ","160-162"
"49640","Vincenzi, S., Crivelli, A. J., Jesensek, D., Rubin, J. F., Poizat, G. and De Leo, G. A.",2008,"Potential factors controlling the population viability of newly introduced endangered marble trout populations","Biological Conservation","141"," 1 ","198-210"
"64853","Hirsch, P. D., Adams, W. M., Brosius, J. P., Zia, A., Bariola, N. and Dammert, J. L.",2011,"Acknowledging Conservation Trade-Offs and Embracing Complexity","Conservation Biology","25"," 2 ","259-264"
"65711","Deng, M. H., Kimura, S. D., Lee, J., Hojito, M. and Yoh, M.",2011,"Denitrification on Andosols in an intensive dairy farming region of central Japan","Agriculture Ecosystems & Environment","144"," 1 ","330-337"
"41841","Van der Stoel, C. D., Duyts, H. and Van der Putten, W. H.",2006,"Population dynamics of a host-specific root-feeding cyst nematode and resource quantity in the root zone of a clonal grass","Oikos","112","3","651-659"
"67378","Sridhar, H., Srinivasan, U., Askins, R. A., Canales-Delgadillo, J. C., Chen, C. C., Ewert, D. N., Gale, G. A., Goodale, E., Gram, W. K., Hart, P. J., Hobson, K. A., Hutto, R. L., Kotagama, S. W., Knowlton, J. L., Lee, T. M., Munn, C. A., Nimnuan, S., Nizam, B. Z., Peron, G., Robin, V. V., Rodewald, A. D., Rodewald, P. G., Thomson, R. L., Trivedi, P., Van Wilgenburg, S. L. and Shanker, K.",2012,"Positive Relationships between Association Strength and Phenotypic Similarity Characterize the Assembly of Mixed-Species Bird Flocks Worldwide","American Naturalist","180"," 6 ","777-790"
"39504","Marty, J. T.",2005,"Effects of cattle grazing on diversity in ephemeral wetlands","Conservation Biology","19","5","1626-1632"
"36362","Kimura, M. T.",2004,"Cold and heat tolerance of drosophilid flies with reference to their latitudinal distributions","Oecologia","140","3","442-449"
"67516","Shelomi, M.",2012,"Where Are We Now? Bergmann's Rule Sensu Lato in Insects","American Naturalist","180"," 4 ","511-519"
"64590","Kachel, A. F., Premo, L. S. and Hublin, J. J.",2011,"Grandmothering and natural selection","Proceedings of the Royal Society B-Biological Sciences","278"," 1704 ","384-391"
"65320","Frankham, R., Ballou, J. D., Eldridge, M. D. B., Lacy, R. C., Ralls, K., Dudash, M. R. and Fenster, C. B.",2011,"Predicting the Probability of Outbreeding Depression","Conservation Biology","25"," 3 ","465-475"
"42609","Pravosudov, V. V., Kitaysky, A. S. and Omanska, A.",2006,"The relationship between migratory behaviour, memory and the hippocampus: an intraspecific comparison","Proceedings of the Royal Society B-Biological Sciences","273","1601","2641-2649"
"45064","Betts, M. G., Forbes, G. J., Diamond, A. W. and Taylor, P. D.",2006,"Independent effects of fragmentation on forest songbirds: An organism-based approach","Ecological Applications","16","3","1076-1089"
"71346","Ackerman, F. and Munitz, C.",2012,"Reply to Anthoff and Tol","Ecological Economics","81"," ","43-43"
"45856","Taipale, S., Kankaala, P. and Jones, R. I.",2007,"Contributions of different organic carbon sources to Daphnia in the pelagic foodweb of a small polyhumic lake: Results from mesocosm (DIC)-C-13-additions","Ecosystems","10","5","757-772"
"68761","Lydersen, J. and North, M.",2012,"Topographic Variation in Structure of Mixed-Conifer Forests Under an Active-Fire Regime","Ecosystems","15"," 7 ","1134-1146"
"71687","Wandrag, E. M., Sheppard, A., Duncan, R. P. and Hulme, P. E.",2013,"Reduced availability of rhizobia limits the performance but not invasiveness of introduced Acacia","Journal of Ecology","101"," 5 ","1103-1113"
"56601","Ellison, K.",2009,"Toxins and toddlers","Frontiers in Ecology and the Environment","7"," 4 ","228-228"
"54744","Orr, D. W.",2009,"Retrospect and Prospect: the Unbearable Lightness of Conservation","Conservation Biology","23"," 6 ","1349-1351"
"71959","Thuiller, W., Munkemuller, T., Lavergne, S., Mouillot, D., Mouquet, N., Schiffers, K. and Gravel, D.",2013,"A road map for integrating eco-evolutionary processes into biodiversity models","Ecology Letters","16"," ","94-105"
"66858","Weyland, F., Baudry, J. and Ghersa, C. M.",2012,"A fuzzy logic method to assess the relationship between landscape patterns and bird richness of the Rolling Pampas","Landscape Ecology","27"," 6 ","869-885"
"68177","Parks, N.",2012,"Advances in ocean acidification research","Frontiers in Ecology and the Environment","10"," 7 ","345-345"
"74616","Hall, S. J., Trujillo, J., Nakase, D., Strawhacker, C., Kruse-Peeples, M., Schaafsma, H. and Briggs, J.",2013,"Legacies of Prehistoric Agricultural Practices Within Plant and Soil Properties Across an Arid Ecosystem","Ecosystems","16"," 7 ","1273-1293"
"58410","Smith, P., Lanigan, G., Kutsch, W. L., Buchmann, N., Eugster, W., Aubinet, M., Ceschia, E., Beziat, P., Yeluripati, J. B., Osborne, B., Moors, E. J., Brut, A., Wattenbach, M., Saunders, M. and Jones, M.",2010,"Measurements necessary for assessing the net ecosystem carbon budget of croplands","Agriculture Ecosystems & Environment","139"," 3 ","302-315"
"64625","Joly, M. and Zimmermann, E.",2011,"Do solitary foraging nocturnal mammals plan their routes?","Biology Letters","7"," 4 ","638-640"
"48091","Girardin, M. P.",2007,"Interannual to decadal changes in area burned in Canada from 1781 to 1982 and the relationship to Northern Hemisphere land temperatures","Global Ecology and Biogeography","16"," 5 ","557-566"
"49085","Bennett, E. M. and Balvanera, P.",2007,"The future of production systems in a globalized world","Frontiers in Ecology and the Environment","5"," 4 ","191-198"
"54012","Soderbaum, P.",2009,"Green economics, an introduction to theory, policy and practice","Ecological Economics","69"," 1 ","206-206"
"58017","Verdu, P., Leblois, R., Froment, A., Thery, S., Bahuchet, S., Rousset, F., Heyer, E. and Vitalis, R.",2010,"Limited dispersal in mobile hunter-gatherer Baka Pygmies","Biology Letters","6"," 6 ","858-861"
"49689","Veen, G. F., Blair, J. M., Smith, M. D. and Collins, S. L.",2008,"Influence of grazing and fire frequency on small-scale plant community structure and resource variability in native tallgrass prairie","Oikos","117"," 6 ","859-866"
"70435","Dahl, E. L., Bevanger, K., Nygard, T., Roskaft, E. and Stokke, B. G.",2012,"Reduced breeding success in white-tailed eagles at Smola windfarm, western Norway, is caused by mortality and displacement","Biological Conservation","145"," 1 ","79-85"
"65000","Hall, C. J., Jordaan, A. and Frisk, M. G.",2011,"The historic influence of dams on diadromous fish habitat with a focus on river herring and hydrologic longitudinal connectivity","Landscape Ecology","26"," 1 ","95-107"
"67474","Singh, J., Budki, P., Rani, S. and Kumar, V.",2012,"Temperature alters the photoperiodically controlled phenologies linked with migration and reproduction in a night-migratory songbird","Proceedings of the Royal Society B-Biological Sciences","279"," 1728 ","509-515"
"56521","Fawcett, T. W. and Bleay, C.",2009,"Previous experiences shape adaptive mate preferences","Behavioral Ecology","20"," 1 ","68-78"
"43050","Moller, A. P., Hobson, K. A., Mousseau, T. A. and Peklo, A. M.",2006,"Chernobyl as a population sink for barn swallows: Tracking dispersal using stable-isotope profiles","Ecological Applications","16","5","1696-1705"
"50891","Morton, D. C., Defries, R. S., Randerson, J. T., Giglio, L., Schroeder, W. and van Der Werf, G. R.",2008,"Agricultural intensification increases deforestation fire activity in Amazonia","Global Change Biology","14"," 10 ","2262-2275"
"65870","Costantini, D.",2011,"On the measurement of circulating antioxidant capacity and the nightmare of uric acid","Methods in Ecology and Evolution","2"," 3 ","321-325"
"49562","Watts, C. H., Clarkson, B. R. and Didham, R. K.",2008,"Rapid beetle community convergence following experimental habitat restoration in a mined peat bog","Biological Conservation","141"," 2 ","568-579"
"60278","Howell, K. L.",2010,"A benthic classification system to aid in the implementation of marine protected area networks in the deep/high seas of the NE Atlantic","Biological Conservation","143"," 5 ","1041-1056"
"40011","Hylander, K., Nilsson, C., Jonsson, B. G. and Gothner, T.",2005,"Differences in habitat quality explain nestedness in a land snail meta-community","Oikos","108","2","351-361"
"45996","Solberg, E. J., Heim, M., Grotan, V., Saether, B. E. and Garel, M.",2007,"Annual variation in maternal age and calving date generate cohort effects in moose (Alces alces) body mass","Oecologia","154","2","259-271"
"66526","Antonarakis, A. S., Saatchi, S. S., Chazdon, R. L. and Moorcroft, P. R.",2011,"Using Lidar and Radar measurements to constrain predictions of forest ecosystem structure and function","Ecological Applications","21"," 4 ","1120-1137"
"50543","Poulin, R. and Thomas, F.",2008,"Epigenetic effects of infection on the phenotype of host offspring: parasites reaching across host generations","Oikos","117"," 3 ","331-335"
"57348","Belzner, S., Voigt, C., Catchpole, C. K. and Leitner, S.",2009,"Song learning in domesticated canaries in a restricted acoustic environment","Proceedings of the Royal Society B-Biological Sciences","276"," 1669 ","2881-2886"
"36882","Garamszegi, L. Z., Torok, J., Michl, G. and Moller, A. P.",2004,"Female survival, lifetime reproductive success and mating status in a passerine bird","Oecologia","138","1","48-56"
"34663","Wilcove, D. S., Bean, M. J., Long, B., Snape, W. J., Beehler, B. M. and Eisenberg, J.",2004,"The private side of conservation","Frontiers in Ecology and the Environment","2","6","326-331"
