"","Author","Year","Title","Journal","Volume","Issue","Pages"
"38295","Tomkins, J. L., Kotiaho, J. S. and LeBas, N. R.",2005,"Phenotypic plasticity in the developmental integration of morphological trade-offs and secondary sexual trait compensation","Proceedings of the Royal Society B-Biological Sciences","272","1562","543-551"
"63601","Oostindjer, M., Munoz, J. M., Van den Brand, H., Kemp, B. and Bolhuis, J. E.",2011,"Maternal presence and environmental enrichment affect food neophobia of piglets","Biology Letters","7"," 1 ","19-22"
"47872","Hayward, M. W., O'Brien, J. and Kerley, G. I. H.",2007,"Carrying capacity of large African predators: Predictions and tests","Biological Conservation","139"," 1-2 ","219-229"
"41939","Thuille, A. and Schulze, E. D.",2006,"Carbon dynamics in successional and afforested spruce stands in Thuringia and the Alps","Global Change Biology","12","2","325-342"
"49376","Zhang, S., Hou, S., Wu, Y. and Qin, D.",2008,"Bacteria in Himalayan glacial ice and its relationship to dust","Biogeosciences","5"," 6 ","1741-1750"
"63167","Rodewald, A. D., Kearns, L. J. and Shustack, D. P.",2011,"Anthropogenic resource subsidies decouple predator-prey relationships","Ecological Applications","21"," 3 ","936-943"
"62251","White, P. J., Garrott, R. A., Hamlin, K. L., Cook, R. C., Cook, J. G. and Cunningham, J. A.",2011,"Body condition and pregnancy in northern Yellowstone elk: Evidence for predation risk effects?","Ecological Applications","21"," 1 ","3-8"
"72832","Price, J. N. and Partel, M.",2013,"Can limiting similarity increase invasion resistance? A meta-analysis of experimental studies","Oikos","122"," 5 ","649-656"
"51881","Hawkes, C. V., Hartley, I. P., Ineson, P. and Fitter, A. H.",2008,"Soil temperature affects carbon allocation within arbuscular mycorrhizal networks and carbon transport from plant to fungus","Global Change Biology","14"," 5 ","1181-1190"
"62996","Schlaepfer, M. A., Sax, D. F. and Olden, J. D.",2011,"The Potential Conservation Value of Non-Native Species","Conservation Biology","25"," 3 ","428-437"
"37269","Critchley, C. N. R., Burke, M. J. W. and Stevens, D. P.",2004,"Conservation of lowland semi-natural grasslands in the UK: a review of botanical monitoring results from agri-environment schemes","Biological Conservation","115","2","263-278"
"39222","Norris, D. R.",2005,"Carry-over effects and habitat quality in migratory populations","Oikos","109","1","178-186"
"73206","Nelson, J. A., Stallings, C. D., Landing, W. M. and Chanton, J.",2013,"Biomass Transfer Subsidizes Nitrogen to Offshore Food Webs","Ecosystems","16"," 6 ","1130-1138"
"40980","Chabi-Olaye, A., Nolte, C., Schulthess, F. and Borgemeister, C.",2005,"Effects of grain legumes and cover crops on maize yield and plant damage by Busseola fusca (Fuller) (Lepidoptera : Noctuidae) in the humid forest of southern Cameroon","Agriculture Ecosystems & Environment","108","1","17-28"
"43487","Lambert, W.",2006,"Functional convergence of ecosystems: Evidence from body mass distributions of North American late Miocene mammal faunas","Ecosystems","9","1","97-118"
"64247","Lesser, M. P., Carleton, K. L., Bottger, S. A., Barry, T. M. and Walker, C. W.",2011,"Sea urchin tube feet are photosensory organs that express a rhabdomeric-like opsin and PAX6","Proceedings of the Royal Society B-Biological Sciences","278"," 1723 ","3371-3379"
"51243","Lindo, Z., Winchester, N. N. and Didham, R. K.",2008,"Nested patterns of community assembly in the colonisation of artificial canopy habitats by oribatid mites","Oikos","117"," 12 ","1856-1864"
"52058","Gonzalez-Estrada, E., Rodriguez, L. C., Walen, V. K., Naab, J. B., Koo, J., Jones, J. W., Herrero, M. and Thornton, P. K.",2008,"Carbon sequestration and farm income in West Africa: Identifying best management practices for smallholder agricultural systems in northern Ghana","Ecological Economics","67"," 3 ","492-502"
"73359","Miranda, M., Parrini, F. and Dalerum, F.",2013,"A categorization of recent network approaches to analyse trophic interactions","Methods in Ecology and Evolution","4"," 10 ","897-905"
"75533","Colombo, S., Christie, M. and Hanley, N.",2013,"What are the consequences of ignoring attributes in choice experiments? Implications for ecosystem service valuation","Ecological Economics","96"," ","25-35"
"51131","Marcora, P., Hensen, I., Renison, D., Seltmann, P. and Wesche, K.",2008,"The performance of Polylepis australis trees along their entire altitudinal range: implications of climate change for their conservation","Diversity and Distributions","14"," 4 ","630-636"
"72916","Pickett, E. J., Stockwell, M. P., Bower, D. S., Garnham, J. I., Pollard, C. J., Clulow, J. and Mahony, M. J.",2013,"Achieving no net loss in habitat offset of a threatened frog required high offset ratio and intensive monitoring","Biological Conservation","157"," ","156-162"
"63597","Orange, F., Chabin, A., Gorlas, A., Lucas-Staat, S., Geslin, C., Le Romancer, M., Prangishvili, D., Forterre, P. and Westall, F.",2011,"Experimental fossilisation of viruses from extremophilic Archaea","Biogeosciences","8"," 6 ","1465-1475"
"68476","Miller-Rushing, A., Primack, R. and Bonney, R.",2012,"The history of public participation in ecological research","Frontiers in Ecology and the Environment","10"," 6 ","285-290"
"75805","Burton, A.",2013,"Pesticide procrastination puts Canada in court","Frontiers in Ecology and the Environment","11"," 8 ","402-402"
"63928","Mella-Flores, D., Mazard, S., Humily, F., Partensky, F., Mahe, F., Bariat, L., Courties, C., Marie, D., Ras, J., Mauriac, R., Jeanthon, C., Bendif, E. M., Ostrowski, M., Scanlan, D. J. and Garczarek, L.",2011,"Is the distribution of Prochlorococcus and Synechococcus ecotypes in the Mediterranean Sea affected by global warming?","Biogeosciences","8"," 9 ","2785-2804"
"76798","Stevens, J. R.",2014,"Evolutionary pressures on primate intertemporal choice","Proceedings of the Royal Society B-Biological Sciences","281"," 1786 ",""
"62000","Alberti, G., Delle Vedove, G., Zuliani, M., Peressotti, A., Castaldi, S. and Zerbi, G.",2010,"Changes in CO2 emissions after crop conversion from continuous maize to alfalfa","Agriculture Ecosystems & Environment","136"," 1-2 ","139-147"
"47965","Gustafson, L., Showers, W., Kwak, T., Levine, J. and Stoskopf, M.",2007,"Temporal and spatial variability in stable isotope compositions of a freshwater mussel: implications for biomonitoring and ecological studies","Oecologia","152"," 1 ","140-150"
"70598","Chilarescu, C. and Viasu, I.",2012,"Dimensions and logarithmic function in economics: A comment","Ecological Economics","75"," ","10-11"
"51015","Menge, B. A., Chan, F. and Lubchenco, J.",2008,"Response of a rocky intertidal ecosystem engineer and community dominant to climate change","Ecology Letters","11"," 2 ","151-162"
"70201","Echols, A. and Vitousek, P.",2012,"Managing water, harvesting results","Frontiers in Ecology and the Environment","10"," 1 ","3-3"
"53966","Stefanescu, C. and Traveset, A.",2009,"Factors influencing the degree of generalization in flower use by Mediterranean butterflies","Oikos","118"," 7 ","1109-1117"
"37743","Banks, P. B., Norrdahl, K., Nordstrom, M. and Korpimaki, E.",2004,"Dynamic impacts of feral mink predation on vole metapopulations in the outer archipelago of the Baltic Sea","Oikos","105","1","79-88"
"44961","Brady, S. G., Sipes, S., Pearson, A. and Danforth, B. N.",2006,"Recent and simultaneous origins of eusociality in halictid bees","Proceedings of the Royal Society B-Biological Sciences","273","1594","1643-1649"
"60001","Koenig, W. D., Hochachka, W. M., Zuckerberg, B. and Dickinson, J. L.",2010,"Ecological determinants of American crow mortality due to West Nile virus during its North American sweep","Oecologia","163"," 4 ","903-909"
"61520","Burton, A.",2010,"Fish-friendly green energy from streams?","Frontiers in Ecology and the Environment","8"," 10 ","510-510"
"57655","Zimmermann, M., Meir, P., Silman, M. R., Fedders, A., Gibbon, A., Malhi, Y., Urrego, D. H., Bush, M. B., Feeley, K. J., Garcia, K. C., Dargie, G. C., Farfan, W. R., Goetz, B. P., Johnson, W. T., Kline, K. M., Modi, A. T., Rurau, N. M. Q., Staudt, B. T. and Zamora, F.",2010,"No Differences in Soil Carbon Stocks Across the Tree Line in the Peruvian Andes","Ecosystems","13"," 1 ","62-74"
"58785","Rist, J., Milner-Gulland, E. J., Cowlishaw, G. and Rowcliffe, M.",2010,"Hunter Reporting of Catch per Unit Effort as a Monitoring Tool in a Bushmeat-Harvesting System","Conservation Biology","24"," 2 ","489-499"
"49519","Whitehead, H., McGill, B. and Worm, B.",2008,"Diversity of deep-water cetaceans in relation to temperature: implications for ocean warming","Ecology Letters","11"," 11 ","1198-1207"
"63887","Millen, A. and Anderson, J. R.",2011,"Neither infants nor toddlers catch yawns from their mothers","Biology Letters","7"," 3 ","440-442"
"48382","Emery, C.",2007,"Pond biodiversity dries up during drought","Frontiers in Ecology and the Environment","5"," 10 ","517-517"
"50041","Smiseth, P. T. and Parker, H. J.",2008,"Is there a cost to larval begging in the burying beetle Nicrophorus vespilloides?","Behavioral Ecology","19"," 6 ","1111-1115"
"43851","Hirota, M., Tang, Y. H., Hu, Q. W., Hirata, S., Kato, T., Mo, W. H., Cao, G. M. and Mariko, S.",2006,"Carbon dioxide dynamics and controls in a deep-water wetland on the Qinghai-Tibetan Plateau","Ecosystems","9","4","673-688"
"38912","Ramm, S. A., Parker, G. A. and Stockley, P.",2005,"Sperm competition and the evolution of male reproductive anatomy in rodents","Proceedings of the Royal Society B-Biological Sciences","272","1566","949-955"
"40479","Forstmeier, W.",2005,"Quantitative genetics and behavioural correlates of digit ratio in the zebra finch","Proceedings of the Royal Society B-Biological Sciences","272","1581","2641-2649"
"49061","Bhagabati, N. K.",2007,"Conservation research in India","Frontiers in Ecology and the Environment","5"," 3 ","123-123"
"47256","Lindenmayer, D. B., Fischer, J. and Hobbs, R.",2007,"The need for pluralism in landscape models: a reply to Dunn and Majer","Oikos","116"," 8 ","1419-1421"
"65488","Faithfull, C. L., Huss, M., Vrede, T. and Bergstrom, A. K.",2011,"Bottom-up carbon subsidies and top-down predation pressure interact to affect aquatic food web structure","Oikos","120"," 2 ","311-320"
"76544","Winfree, R., Williams, N. M., Dushoff, J. and Kremen, C.",2014,"Species Abundance, Not Diet Breadth, Drives the Persistence of the Most Linked Pollinators as Plant-Pollinator Networks Disassemble","American Naturalist","183"," 5 ","600-611"
"67489","Sillett, T. S., Chandler, R. B., Royle, J. A., Kery, M. and Morrison, S. A.",2012,"Hierarchical distance-sampling models to estimate population size and habitat-specific abundance of an island endemic","Ecological Applications","22"," 7 ","1997-2006"
"68604","McCauley, D. J., Young, H. S., Dunbar, R. B., Estes, J. A., Semmens, B. X. and Michel, F.",2012,"Assessing the effects of large mobile predators on ecosystem connectivity","Ecological Applications","22"," 6 ","1711-1717"
"67913","Ramsayer, J., Fellous, S., Cohen, J. E. and Hochberg, M. E.",2012,"Taylor's Law holds in experimental bacterial populations but competition does not influence the slope","Biology Letters","8"," 2 ","316-319"
"68493","Miller, C.",2012,"Twitter trumps science in trawler ban","Frontiers in Ecology and the Environment","10"," 9 ","460-460"
"39031","Philpott, S. M. and Foster, P. F.",2005,"Nest-site limitation in coffee agroecosystems: Artificial nests maintain diversity of arboreal ants","Ecological Applications","15","4","1478-1485"
"56502","Ferng, J. J.",2009,"Applying input-output analysis to scenario analysis of ecological footprints","Ecological Economics","69"," 2 ","345-354"
"76603","Wang, Z., Dai, M. Y., Wang, Y., Cooper, K. L., Zhu, T. T., Dong, D., Zhang, J. P. and Zhang, S. Y.",2014,"Unique expression patterns of multiple key genes associated with the evolution of mammalian flight","Proceedings of the Royal Society B-Biological Sciences","281"," 1783 ",""
"53725","Van Doorslaer, W., Vanoverbeke, J., Duvivier, C., Rousseaux, S., Jansen, M., Jansen, B., Feuchtmayr, H., Atkinson, D., Moss, B., Stoks, R. and De Meester, L.",2009,"Local adaptation to higher temperatures reduces immigration success of genotypes from a warmer region in the water flea Daphnia","Global Change Biology","15"," 12 ","3046-3055"
"44775","Chapa-Vargas, L. and Robinson, S. K.",2006,"Nesting success of a songbird in a complex floodplain forest landscape in Illinois, USA: local fragmentation vs. vegetation structure","Landscape Ecology","21","4","525-537"
"45827","Thackeray, S. J.",2007,"Crustacean zooplankton species richness and productivity: to what extent do the conclusions depend upon the choice of metrics?","Oikos","116","4","614-628"
"40979","Chadwick, W. and Little, T. J.",2005,"A parasite-mediated life-history shift in Daphnia magna","Proceedings of the Royal Society B-Biological Sciences","272","1562","505-509"
"58595","Schmidt, K. A., Dall, S. R. X. and van Gils, J. A.",2010,"The ecology of information: an overview on the ecological significance of making informed decisions","Oikos","119"," 2 ","304-316"
"39770","Krasnov, B. R., Poulin, R., Shenbrot, G. I., Mouillot, D. and Khokhlova, I. S.",2005,"Host specificity and geographic range in haematophagous ectoparasites","Oikos","108","3","449-456"
"77658","Leducq, J. B., Charron, G., Samani, P., Dube, A. K., Sylvester, K., James, B., Almeida, P., Sampaio, J. P., Hittinger, C. T., Bell, G. and Landry, C. R.",2014,"Local climatic adaptation in a widespread microorganism","Proceedings of the Royal Society B-Biological Sciences","281"," 1777 ",""
"78777","Atobe, T., Osada, Y., Takeda, H., Kuroe, M. and Miyashita, T.",2014,"Habitat connectivity and resident shared predators determine the impact of invasive bullfrogs on native frogs in farm ponds","Proceedings of the Royal Society B-Biological Sciences","281"," 1786 ",""
"41805","Verburg, P. H., Veldkamp, A. and Rounsevell, M. D. A.",2006,"Scenario-based studies of future land use in Europe","Agriculture Ecosystems & Environment","114","1","01-Jun"
"35908","Miller, C.",2004,"Australian states move against GE crops","Frontiers in Ecology and the Environment","2","4","177-177"
"42461","Roberts, P. D., Stewart, G. B. and Pullin, A. S.",2006,"Are review articles a reliable source of evidence to support conservation and environmental management? A comparison with medicine","Biological Conservation","132","4","409-423"
"73275","Muller, M. and Groothuis, T. G. G.",2013,"Within-Clutch Variation in Yolk Testosterone as an Adaptive Maternal Effect to Modulate Avian Sibling Competition: Evidence from a Comparative Study","American Naturalist","181"," 1 ","125-136"
"46072","Siepielski, A. M. and Benkman, C. W.",2007,"Extreme environmental variation sharpens selection that drives the evolution of a mutualism","Proceedings of the Royal Society B-Biological Sciences","274","1620","1799-1805"
"78648","Bocedi, G., Palmer, S. C. F., Pe'er, G., Heikkinen, R. K., Matsinos, Y. G., Watts, K. and Travis, J. M. J.",2014,"RangeShifter: a platform for modelling spatial eco-evolutionary dynamics and species' responses to environmental changes","Methods in Ecology and Evolution","5"," 4 ","388-396"
"75409","Darling, E. S., McClanahan, T. R. and Cote, I. M.",2013,"Life histories predict coral community disassembly under multiple stressors","Global Change Biology","19"," 6 ","1930-1940"
"46262","Rytwinski, T. and Fahrig, L.",2007,"Effect of road density on abundance of white-footed mice","Landscape Ecology","22"," 10 ","1501-1512"
"59618","Marchetto, K. M., Jongejans, E., Shea, K. and Isard, S. A.",2010,"Plant spatial arrangement affects projected invasion speeds of two invasive thistles","Oikos","119"," 9 ","1462-1468"
"43867","Hiddink, J. G., Jennings, S. and Kaiser, M. J.",2006,"Indicators of the ecological impact of bottom-trawl disturbance on seabed communities","Ecosystems","9","7","1190-1199"
"56363","Galvez, D. A. and Tyree, M. T.",2009,"Impact of simulated herbivory on water relations of aspen (Populus tremuloides) seedlings: the role of new tissue in the hydraulic conductivity recovery cycle","Oecologia","161"," 4 ","665-671"
"45025","Bock, C. E., Jones, Z. F. and Bock, J. H.",2006,"Rodent communities in an exurbanizing southwestern landscape (USA)","Conservation Biology","20","4","1242-1250"
"69936","Gange, A. C., Eschen, R., Wearn, J. A., Thawer, A. and Sutton, B. C.",2012,"Differential effects of foliar endophytic fungi on insect herbivores attacking a herbaceous plant","Oecologia","168"," 4 ","1023-1031"
"40587","Evans, D. M., Redpath, S. M., Evans, S. A., Elston, D. A. and Dennis, P.",2005,"Livestock grazing affects the egg size of an insectivorous passerine","Biology Letters","1","3","322-325"
"66558","Amos, W., Driscoll, E. and Hoffman, J. I.",2011,"Candidate genes versus genome-wide associations: which are better for detecting genetic susceptibility to infectious disease?","Proceedings of the Royal Society B-Biological Sciences","278"," 1709 ","1183-1188"
"75858","Brown, S. L., Reid, D. and Rogan, E.",2013,"A risk-based approach to rapidly screen vulnerability of cetaceans to impacts from fisheries bycatch","Biological Conservation","168"," ","78-87"
"46650","Parker, H., Rosell, F. and Mysterud, A.",2007,"Harvesting of males delays female breeding in a socially monogamous mammal; the beaver","Biology Letters","3"," 1 ","106-108"
"57584","Alvarez, M., Lo Monaco, C., Tanhua, T., Yool, A., Oschlies, A., Bullister, J. L., Goyet, C., Metzl, N., Touratier, F., McDonagh, E. and Bryden, H. L.",2009,"Estimating the storage of anthropogenic carbon in the subtropical Indian Ocean: a comparison of five different approaches","Biogeosciences","6"," 4 ","681-703"
"67269","Tabarelli, M., Peres, C. A. and Melo, F. P. L.",2012,"The 'few winners and many losers' paradigm revisited: Emerging prospects for tropical forest biodiversity","Biological Conservation","155"," ","136-140"
"41301","Bauer, J. T. and Peterson, A. T.",2005,"Visualizing environmental correlates of species geographical range limits","Diversity and Distributions","11","4","275-278"
"58580","Schreiber, S. J.",2010,"Interactive effects of temporal correlations, spatial heterogeneity and dispersal on population persistence","Proceedings of the Royal Society B-Biological Sciences","277"," 1689 ","1907-1914"
"70016","Forster, J., Hirst, A. G. and Woodward, G.",2012,"Growth and development rates have different thermal responses (vol 178, pg 668, 2011)","American Naturalist","180"," 3 ","404-405"
"62093","Zhang, C. H., Liu, H. Y., Bressers, H. T. A. and Buchanan, K. S.",2011,"Productivity growth and environmental regulations - accounting for undesirable outputs: Analysis of China's thirty provincial regions using the Malmquist-Luenberger index","Ecological Economics","70"," 12 ","2369-2379"
"47077","Martinkova, N., McDonald, R. A. and Searle, J. B.",2007,"Stoats (Mustela erminea) provide evidence of natural overland colonization of Ireland","Proceedings of the Royal Society B-Biological Sciences","274"," 1616 ","1387-1393"
"36841","Gewin, V.",2004,"Unregulated wells drain water reserves","Frontiers in Ecology and the Environment","2","8","398-398"
"64250","Leslie, A. B.",2011,"Predation and protection in the macroevolutionary history of conifer cones","Proceedings of the Royal Society B-Biological Sciences","278"," 1720 ","3003-3008"
"38702","Sandercock, B. K., Martin, K. and Hannon, S. J.",2005,"Demographic consequences of age-structure in extreme environments: population models for arctic and alpine ptarmigan","Oecologia","146","1","13-24"
"49715","Van Mooy, B. A. S., Moutin, T., Duhamel, S., Rimmelin, P. and Van Wambeke, F.",2008,"Phospholipid synthesis rates in the eastern subtropical South Pacific Ocean","Biogeosciences","5"," 1 ","133-139"
"44737","Christensen, P. and Hornfeldt, B.",2006,"Habitat preferences of Clethrionomys rufocanus in boreal sweden","Landscape Ecology","21","2","185-194"
"59825","Lemasson, A., Gandon, E. and Hausberger, M.",2010,"Attention to elders' voice in non-human primates","Biology Letters","6"," 3 ","325-328"
"43228","Marechal, K. and Hecq, W.",2006,"Temporary credits: A solution to the potential non-permanence of carbon sequestration in forests?","Ecological Economics","58","4","699-716"
"56374","Galatowitsch, S., Frelich, L. and Phillips-Mao, L.",2009,"Regional climate change adaptation strategies for biodiversity conservation in a midcontinental region of North America","Biological Conservation","142"," 10 ","2012-2022"
"76610","Wang, S. K., Chu, T. J., Huang, D. Q., Li, B. and Wu, J. H.",2014,"Incorporation of Exotic Spartina alterniflora into Diet of Deposit-Feeding Snails in the Yangtze River Estuary Salt Marsh: Stable Isotope and Fatty Acid Analyses","Ecosystems","17"," 4 ","567-577"
"65988","Chaplin-Kramer, R., O'Rourke, M. E., Blitzer, E. J. and Kremen, C.",2011,"A meta-analysis of crop pest and natural enemy response to landscape complexity","Ecology Letters","14"," 9 ","922-932"
"61456","Caro, S. P., Sewall, K. B., Salvante, K. G. and Sockman, K. W.",2010,"Female Lincoln's sparrows modulate their behavior in response to variation in male song quality","Behavioral Ecology","21"," 3 ","562-569"
"53528","Western, D., Groom, R. and Worden, J.",2009,"The impact of subdivision and sedentarization of pastoral lands on wildlife in an African savanna ecosystem","Biological Conservation","142"," 11 ","2538-2546"
"67536","Seppala, O., Karvonen, A., Rellstab, C., Louhi, K. R. and Jokela, J.",2012,"Reciprocal Interaction Matrix Reveals Complex Genetic and Dose-Dependent Specificity among Coinfecting Parasites","American Naturalist","180"," 3 ","306-315"
"66169","Browning, D. M. and Archer, S. R.",2011,"Protection from livestock fails to deter shrub proliferation in a desert landscape with a history of heavy grazing","Ecological Applications","21"," 5 ","1629-1642"
"55327","Lowman, M. and Randle, D. C.",2009,"Ecological mentoring: inspiring future scientists","Frontiers in Ecology and the Environment","7"," 3 ","119-119"
"76513","Yamauchi, A. and Namba, T.",2014,"Dynamics of predator and modular prey: effects of module consumption on stability of prey-predator system","Oikos","123"," 2 ","161-172"
"73132","O'connor, N. E. and Donohue, I.",2013,"Environmental context determines multi-trophic effects of consumer species loss","Global Change Biology","19"," 2 ","431-440"
"39301","Muller, C. B., Fellowes, M. D. E. and Godfray, H. C. J.",2005,"Relative importance of fertiliser addition to plants and exclusion of predators for aphid growth in the field","Oecologia","143","3","419-427"
"76524","Xepapadeas, A., Ralli, P., Kougea, E., Spyrou, S., Stavropoulos, N., Tsiaousi, V. and Tsivelikas, A.",2014,"Valuing insurance services emerging from a gene bank: The case of the Greek Gene Bank","Ecological Economics","97"," ","140-149"
"55969","Hodgson, J. A., Moilanen, A., Bourn, N. A. D., Bulman, C. R. and Thomas, C. D.",2009,"Managing successional species: Modelling the dependence of heath fritillary populations on the spatial distribution of woodland management","Biological Conservation","142"," 11 ","2743-2751"
"49879","Tallis, H., Ferdana, Z. and Gray, E.",2008,"Linking terrestrial and marine conservation planning and threats analysis","Conservation Biology","22"," 1 ","120-130"
"73003","Pavlick, R., Drewry, D. T., Bohn, K., Reu, B. and Kleidon, A.",2013,"The Jena Diversity-Dynamic Global Vegetation Model (JeDi-DGVM): a diverse approach to representing terrestrial biogeography and biogeochemistry based on plant functional trade-offs","Biogeosciences","10"," 6 ","4137-4177"
"46461","Quinones, A., Martinez-Alcantara, B. and Legaz, F.",2007,"Influence of irrigation system and fertilization management on seasonal distribution of N in the soil profile and on N-uptake by citrus trees","Agriculture Ecosystems & Environment","122"," 3 ","399-409"
"78249","Eggert, L. S., Buij, R., Lee, M. E., Campbell, P., Dallmeier, F., Fleischer, R. C., Alonso, A. and Maldonado, J. E.",2014,"Using Genetic Profiles of African Forest Elephants to Infer Population Structure, Movements, and Habitat Use in a Conservation and Development Landscape in Gabon","Conservation Biology","28"," 1 ","107-118"
"43247","Mangel, M.",2006,"Commentary: Accounting for uncertainty in marine reserve design","Ecology Letters","9","1","11-Dec"
"52535","de Valpine, P. and Eadie, J. M.",2008,"Conspecific brood parasitism and population dynamics","American Naturalist","172"," 4 ","547-562"
"61196","Curson, D. R., Goguen, C. B. and Mathews, N. E.",2010,"Community-level patterns of population recruitment in a generalist avian brood parasite, the brown-headed cowbird","Oecologia","163"," 3 ","601-612"
"47822","Hernandez, J. M. and Leon, C. J.",2007,"The interactions between natural and physical capitals in the tourist lifecycle model","Ecological Economics","62"," 1 ","184-193"
"37965","Wright, A. N. and Gompper, M. E.",2005,"Altered parasite assemblages in raccoons in response to manipulated resource availability","Oecologia","144","1","148-156"
"76604","Wang, Y. P., Chen, B. C., Wieder, W. R., Leite, M., Medlyn, B. E., Rasmussen, M., Smith, M. J., Agusto, F. B., Hoffman, F. and Luo, Y. Q.",2014,"Oscillatory behavior of two nonlinear microbial models of soil carbon decomposition","Biogeosciences","11"," 7 ","1817-1831"
"52534","De-Camino-Beck, T. and Lewis, M. A.",2008,"On net reproductive rate and the timing of reproductive output","American Naturalist","172"," 1 ","128-139"
"72090","Subramanian, S., Beans-Picon, G., Swaminathan, S. K., Millar, C. D. and Lambert, D. M.",2013,"Evidence for a recent origin of penguins","Biology Letters","9"," 6 ",""
"56470","Flecker, A. S.",2009,"Crossing borders: promoting graduate research in the developing world Faculty response","Frontiers in Ecology and the Environment","7"," 6 ","334-334"
