"","Author","Year","Title","Journal","Volume","Issue","Pages"
"42241","Searle, K. R., Hobbs, N. T., Wunder, B. A. and Shipley, L. A.",2006,"Preference in patchy landscapes: the influence of scale-specific intake rates and variance in reward","Behavioral Ecology","17","2","315-323"
"68992","Law, C. S., Breitbarth, E., Hoffmann, L. J., McGraw, C. M., Langlois, R. J., LaRoche, J., Marriner, A. and Safi, K. A.",2012,"No stimulation of nitrogen fixation by non-filamentous diazotrophs under elevated CO2 in the South Pacific","Global Change Biology","18"," 10 ","3004-3014"
"49954","Sterli, J.",2008,"A new, nearly complete stem turtle from the Jurassic of South America with implications for turtle evolution","Biology Letters","4"," 3 ","286-289"
"45502","Wharton, K. E., Dyer, F. C., Huang, Z. Y. and Getty, T.",2007,"The honeybee queen influences the regulation of colony drone production","Behavioral Ecology","18","6","1092-1099"
"36538","Hudak, A. T., Fairbanks, D. H. K. and Brockett, B. H.",2004,"Trends in fire patterns in a southern African savanna under alternative land use practices","Agriculture Ecosystems & Environment","101"," 2-3 ","307-325"
"73263","Murdock, D. J. E., Sansom, I. J. and Donoghue, P. C. J.",2013,"Cutting the first 'teeth': a new approach to functional analysis of conodont elements","Proceedings of the Royal Society B-Biological Sciences","280"," 1768 ",""
"74916","Gagliardi, B. and Pettigrove, V.",2013,"Removal of intensive agriculture from the landscape improves aquatic ecosystem health","Agriculture Ecosystems & Environment","176"," ","1-8"
"39149","Ostlund-Nilsson, S., Becker, J. H. A. and Nilsson, G. E.",2005,"Shrimps remove ectoparasites from fishes in temperate waters","Biology Letters","1","4","454-456"
"46123","Senior, K.",2007,"Dutch wind farms all at sea","Frontiers in Ecology and the Environment","5","8","402-402"
"74581","Hanssen, S. A. and Erikstad, K. E.",2013,"The long-term consequences of egg predation","Behavioral Ecology","24"," 2 ","564-569"
"46337","Rodriguez, J. P., Brotons, L., Bustamante, J. and Seoane, J.",2007,"The application of predictive modelling of species distribution to biodiversity conservation","Diversity and Distributions","13"," 3 ","243-251"
"54842","Nishihiro, J., Uesugi, R., Takagawa, S. and Washitani, I.",2009,"Toward the restoration of a sustainable population of a threatened aquatic plant, Nymphoides peltata: Integrated genetic/demographic studies and practices","Biological Conservation","142"," 9 ","1906-1912"
"78674","Biasi, C., Jokinen, S., Marushchak, M. E., Hamalainen, K., Trubnikova, T., Oinonen, M. and Martikainen, P. J.",2014,"Microbial Respiration in Arctic Upland and Peat Soils as a Source of Atmospheric Carbon Dioxide","Ecosystems","17"," 1 ","112-126"
"47878","Hawkins, B. A., Diniz-Filho, J. A. F., Jaramillo, C. A. and Soeller, S. A.",2007,"Climate, niche conservatism, and the global bird diversity gradient","American Naturalist","170"," ","S16-S27"
"52244","Foote, J. R., Fitzsimmons, L. P., Mennill, D. J. and Ratcliffe, L. M.",2008,"Male chickadees match neighbors interactively at dawn: support for the social dynamics hypothesis","Behavioral Ecology","19"," 6 ","1192-1199"
"35386","Rietkerk, M., Dekker, S. C., Wassen, M. J., Verkroost, A. W. M. and Bierkens, M. F. P.",2004,"A putative mechanism for bog patterning","American Naturalist","163","5","699-708"
"54153","Searle, J. B., Jones, C. S., Gunduz, I., Scascitelli, M., Jones, E. P., Herman, J. S., Rambau, R. V., Noble, L. R., Berry, R. J., Gimenez, M. D. and Johannesdottir, F.",2009,"Of mice and (Viking?) men: phylogeography of British and Irish house mice","Proceedings of the Royal Society B-Biological Sciences","276"," 1655 ","201-207"
"75572","Clark, K. H. and Nicholas, K. A.",2013,"Introducing urban food forestry: a multifunctional approach to increase food security and provide ecosystem services","Landscape Ecology","28"," 9 ","1649-1669"
"38981","Poorter, L., Zuidema, P. A., Pena-Claros, M. and Boot, R. G. A.",2005,"A monocarpic tree species in a polycarpic world: how can Tachigali vasquezii maintain itself so successfully in a tropical rain forest community?","Journal of Ecology","93","2","268-278"
"58668","Sahney, S., Benton, M. J. and Ferry, P. A.",2010,"Links between global taxonomic diversity, ecological diversity and the expansion of vertebrates on land","Biology Letters","6"," 4 ","544-547"
"49567","Warren, P. S., Lerman, S. B. and Charney, N. D.",2008,"Plants of a feather: Spatial autocorrelation of gardening practices in suburban neighborhoods","Biological Conservation","141"," 1 ","3-4"
"42571","Quintern, M. and Sundrum, A.",2006,"Ecological risks of outdoor pig fattening in organic farming and strategies for their reduction - Results of a field experiment in the centre of Germany","Agriculture Ecosystems & Environment","117","4","238-250"
"46040","Skorping, A.",2007,"Selecting for fast and slow maturing worms","Proceedings of the Royal Society B-Biological Sciences","274","1617","1465-1466"
"50595","Phillimore, A. B., Orme, C. D. L., Thomas, G. H., Blackburn, T. M., Bennett, P. M., Gaston, K. J. and Owens, I. P. F.",2008,"Sympatric speciation in birds is rare: Insights from range data and simulations","American Naturalist","171"," 5 ","646-657"
"50233","Sanchirico, J. N., Smith, M. D. and Lipton, D. W.",2008,"An empirical approach to ecosystem-based fishery management","Ecological Economics","64"," 3 ","586-596"
"71225","Archaux, F., Henry, P. Y. and Gimenez, O.",2012,"When can we ignore the problem of imperfect detection in comparative studies?","Methods in Ecology and Evolution","3"," 1 ","188-194"
"78561","Burgess, S. C., Nickols, K. J., Griesemer, C. D., Barnett, L. A. K., Dedrick, A. G., Satterthwaite, E. V., Yamane, L., Morgan, S. G., White, J. W. and Botsford, L. W.",2014,"Beyond connectivity: how empirical methods can quantify population persistence to improve marine protected-area design","Ecological Applications","24"," 2 ","257-270"
"64055","Martin-Ordas, G. and Call, J.",2011,"Memory processing in great apes: the effect of time and sleep","Biology Letters","7"," 6 ","829-832"
"46436","Ranganathan, J., Chan, K. M. A. and Daily, G. C.",2007,"Satellite detection of bird communities in tropical countryside","Ecological Applications","17"," 5 ","1499-1510"
"45275","Amo, L., Lopez, P. and Martin, J.",2006,"Nature-based tourism as a form of predation risk affects body condition and health state of Podarcis muralis lizards","Biological Conservation","131","3","402-409"
"40795","Dayan, T. and Simberloff, D.",2005,"Ecological and community-wide character displacement: the next generation","Ecology Letters","8","8","875-894"
"49272","Anderson, T. M., Ritchie, M. E., Mayemba, E., Eby, S., Grace, J. B. and McNaughton, S. J.",2007,"Forage nutritive quality in the serengeti ecosystem: the roles of fire and herbivory","American Naturalist","170"," 3 ","343-357"
"41575","Wu, J. G.",2006,"Landscape ecology, cross-disciplinarity, and sustainability science","Landscape Ecology","21","1","01-Apr"
"59646","Maherali, H., Caruso, C. M., Sherrard, M. E. and Latta, R. G.",2010,"Adaptive Value and Costs of Physiological Plasticity to Soil Moisture Limitation in Recombinant Inbred Lines of Avena barbata","American Naturalist","175"," 2 ","211-224"
"49574","Ward, D. M., Nislow, K. H. and Folt, C. L.",2008,"Predators reverse the direction of density dependence for juvenile salmon mortality","Oecologia","156"," 3 ","515-522"
"35456","Qvarnstrom, A., Blomgren, V., Wiley, C. and Svedin, N.",2004,"Female collared flycatchers learn to prefer males with an artificial novel ornament","Behavioral Ecology","15","4","543-548"
"56328","Gaube, V., Kaiser, C., Wildenberg, M., Adensam, H., Fleissner, P., Kobler, J., Lutz, J., Schaumberger, A., Schaumberger, J., Smetschka, B., Wolf, A., Richter, A. and Haberl, H.",2009,"Combining agent-based and stock-flow modelling approaches in a participative analysis of the integrated land system in Reichraming, Austria","Landscape Ecology","24"," 9 ","1149-1165"
"69275","Kamel, S. J. and Grosberg, R. K.",2012,"Exclusive male care despite extreme female promiscuity and low paternity in a marine snail","Ecology Letters","15"," 10 ","1167-1173"
"72719","Renfrew, R. B., Kim, D., Perlut, N., Smith, J., Fox, J. and Marra, P. P.",2013,"Phenological matching across hemispheres in a long-distance migratory bird","Diversity and Distributions","19"," 8 ","1008-1019"
"41797","Vesk, P. A.",2006,"Plant size and resprouting ability: trading tolerance and avoidance of damage?","Journal of Ecology","94","5","1027-1034"
"64449","Koenig, W. D., Walters, E. L. and Haydock, J.",2011,"Variable Helper Effects, Ecological Conditions, and the Evolution of Cooperative Breeding in the Acorn Woodpecker","American Naturalist","178"," 2 ","145-158"
"76574","Wellstein, C., Campetella, G., Spada, F., Chelli, S., Mucina, L., Canullo, R. and Bartha, S.",2014,"Context-dependent assembly rules and the role of dominating grasses in semi-natural abandoned sub-Mediterranean grasslands","Agriculture Ecosystems & Environment","182"," ","113-122"
